Emotion,Description,Biblical Perspective,Faithful Response,Action Step
Anger,A heightened emotional reaction often due to perceived injustice or frustration.,Ephesians 4:26 - 'Be angry and do not sin; do not let the sun go down on your anger.',"Pause to breathe, acknowledge the anger without acting on it, pray for patience and clarity, talk to a trusted friend or mentor.",Practice deep breathing; journal the root of the anger; pray Psalm 37:8.
Sadness,"A feeling of sorrow or unhappiness, often in response to loss or disappointment.",Psalm 34:18 - 'The Lord is close to the brokenhearted and saves those who are crushed in spirit.',"Acknowledge the emotion, avoid labeling it as identity, seek God's comfort, share with others.",Write a prayer of lament; read Psalms; take a walk and talk to God about the sadness.
Anxiety,"A sense of worry or unease, typically about something uncertain.",Philippians 4:6-7 - 'Do not be anxious about anything...',"Name the specific worry, turn it over to God in prayer, meditate on Scripture.",List your anxieties; pair each with a biblical truth; breathe and repeat a verse.
Fear,A powerful feeling caused by the belief that something is dangerous or threatening.,"Isaiah 41:10 - 'Fear not, for I am with you...'","Remind yourself God is present, reflect on His past faithfulness, do not isolate.",Memorize fear-fighting verses; visualize placing your fear in God's hands.
Guilt,A feeling of having committed a wrong or failed in an obligation.,"1 John 1:9 - 'If we confess our sins, He is faithful and just to forgive us...'","Confess to God, receive forgiveness, make amends if needed, release shame.",Write a confession prayer; read Psalm 51; speak with a mentor or pastor.
Joy,"A deep, abiding sense of happiness and contentment often connected to God's presence.",Nehemiah 8:10 - 'The joy of the Lord is your strength.',"Acknowledge God's blessings, celebrate them, share joy with others.",Write down 3 blessings; share your joy story with someone.
Overwhelm,Feeling buried or drowned by the weight of circumstances or responsibilities.,"Matthew 11:28 - 'Come to me, all who are weary and burdened...'","Rest in God's presence, simplify tasks, accept help.",Schedule a Sabbath rest; ask someone for help; pray aloud for strength.
Shame,"A painful feeling about oneself as a person, often connected to guilt or failure.",Romans 8:1 - 'There is now no condemnation for those in Christ Jesus.',"Separate identity from actions, claim God's truth over your worth.",Write truth statements; destroy shame-based lies on paper.
Exhaustion,A state of physical or emotional fatigue that can reduce mental clarity and increase emotional vulnerability.,"Matthew 11:28 - 'Come to me, all who labor and are heavy laden, and I will give you rest.'","Acknowledge exhaustion as a signal to rest, not a weakness; bring your fatigue to God in prayer and seek sabbath rhythm.",Schedule intentional rest; take a short nap or nature walk; meditate on Scripture.
Frustration,Feeling upset or annoyed due to inability to change or achieve something.,"Galatians 6:9 - 'Let us not become weary in doing good, for at the proper time we will reap a harvest...'",Name the source of the frustration; seek God's guidance and patience; trust His timing.,Journal triggers; pray for perseverance; take a small break or shift focus.
Loneliness,A sense of isolation or lack of connection with others.,Deuteronomy 31:6 - 'The Lord your God goes with you; he will never leave you nor forsake you.',Affirm God's presence; reach out to community or loved ones; engage in worship.,Text a friend; join a group study; write a prayer declaring God’s closeness.
Confusion,A mental state of uncertainty or lack of clarity about a situation or decision.,Proverbs 3:5-6 - 'Trust in the Lord with all your heart and lean not on your own understanding...',Surrender your need for full understanding; pray for wisdom and discernment.,Make a list of questions; pray over each one; seek godly counsel.
Pride,A sense of self-importance that may prevent humility or openness.,James 4:6 - 'God opposes the proud but gives grace to the humble.',Examine motives; ask God for a humble heart; practice gratitude.,Confess prideful moments; focus on serving others; read Philippians 2.
Love,"A deep affection or care toward someone, which can sometimes feel overwhelming or vulnerable.","1 John 4:18 - 'There is no fear in love, but perfect love drives out fear...'","Embrace love as God's nature; allow love to foster connection, not fear.",Express love intentionally; reflect on God's love for you.
Grief,"A deep sorrow, especially caused by loss.",Psalm 147:3 - 'He heals the brokenhearted and binds up their wounds.',Allow space to mourn; express your pain to God; don’t rush healing.,Write a letter to God about your loss; light a candle in remembrance.
